{"$id":"urn:rd22:step11:gate3-line-subobject:v001","$schema":"https://json-schema.org/draft/2020-12/schema","additionalProperties":false,"properties":{"ambient_carrier_id":{"const":"C_0(K_open_PB;L)"},"cell_id":{"enum":["r","p_M","p_Q","p_G"]},"dimension":{"const":1},"gate3_form":{"additionalProperties":false,"properties":{"result_sha256":{"const":"ea707b3a5e5a93297c793c9f4227b456b97d7f8e184da95d96436299076915da"},"result_span_sha256":{"pattern":"^[0-9a-f]{64}$","type":"string"}},"required":["result_sha256","result_span_sha256"],"type":"object"},"inclusion":{"additionalProperties":false,"properties":{"codomain":{"const":"C_0(K_open_PB;L)"},"domain":{"minLength":1,"type":"string"},"image_summand":{"minLength":1,"type":"string"},"map_id":{"minLength":1,"type":"string"}},"required":["map_id","domain","codomain","image_summand"],"type":"object"},"induced_hermitian_form":{"additionalProperties":false,"properties":{"definition":{"const":"PULLBACK_ALONG_SUBOBJECT_INCLUSION"},"expression":{"minLength":1,"type":"string"},"form_id":{"minLength":1,"type":"string"},"source_form_id":{"const":"GATE3_M0_IDENTITY_FIBER_FORM"}},"required":["form_id","definition","expression","source_form_id"],"type":"object"},"licenses":{"const":{"basis":false,"scalar_trivialization":false,"unit_representative":false}},"line_id":{"enum":["L_r","L_pM","L_pQ","L_pG"]},"schema":{"const":"rd22.step11.gate3-line-subobject.v001"}},"required":["schema","line_id","cell_id","dimension","ambient_carrier_id","inclusion","induced_hermitian_form","gate3_form","licenses"],"type":"object"}