{"ambient_carrier_id":"C_0(K_open_PB;L)","cell_id":"r","dimension":1,"gate3_form":{"result_sha256":"ea707b3a5e5a93297c793c9f4227b456b97d7f8e184da95d96436299076915da","result_span_sha256":"81826f886ce1ddab504162962f931dcfefa1625835b0b0610df592f8a184efd3"},"inclusion":{"codomain":"C_0(K_open_PB;L)","domain":"L_r","image_summand":"r","map_id":"iota_L_r"},"induced_hermitian_form":{"definition":"PULLBACK_ALONG_SUBOBJECT_INCLUSION","expression":"h_L_r=iota_L_r^* M_0 iota_L_r","form_id":"h_L_r","source_form_id":"GATE3_M0_IDENTITY_FIBER_FORM"},"licenses":{"basis":false,"scalar_trivialization":false,"unit_representative":false},"line_id":"L_r","schema":"rd22.step11.gate3-line-subobject.v001"}